username|date|retweets|favorites|text|geo|mentions|hashtags|id|permalink
JustSyl1|2017-08-14 19:28|1|1|"- Anuncio de Verti en Spotify - Ganas de matar aumentando pic.twitter.com/OErboX34xs"||||"897148055761416194"|https://twitter.com/JustSyl1/status/897148055761416194
Mery__Bm|2017-08-11 17:32|0|0|"el anuncio de Verti en spotify ha hecho que me asuste"||||"896031493688000513"|https://twitter.com/Mery__Bm/status/896031493688000513
RedRoyerino|2017-08-06 15:21|0|2|"Me he puesto nervioso y hasta he escrito mal el tweet pero que les follen odio el puto anuncio de Verti en Spotify , que hijos de puta"||||"894186695641485312"|https://twitter.com/RedRoyerino/status/894186695641485312
majadesvestida|2017-07-30 21:08|1|0|"el puto anuncio de spotify de verti me cago en su vida"||||"891737369916919811"|https://twitter.com/majadesvestida/status/891737369916919811
Abudjevic|2017-07-05 10:25|0|1|"Declaración de guerra eterna a verti por ese anuncio infernal en Spotify"||||"882515717589008384"|https://twitter.com/Abudjevic/status/882515717589008384
RedRoyerino|2017-06-26 19:25|0|0|"@verti me cago en vuestros putos muertos y vuestra publicidad de mierda en Spotify no pienso contratar un seguro vuestro en mi puta vida"||@verti||"879390290821468160"|https://twitter.com/RedRoyerino/status/879390290821468160
HiImErni|2017-06-21 17:32|1|0|"¿Qué os parece el anuncio de Verti de spotify ? Porque yo me cago en dios"||||"877549910178058241"|https://twitter.com/HiImErni/status/877549910178058241
daniesteca|2017-06-20 15:01|0|0|"Es increíble el cringe que da el anuncio de Verti de Spotify"||||"877149326337880064"|https://twitter.com/daniesteca/status/877149326337880064
alvaropema|2017-06-18 12:14|0|0|"me cago en tu puto anuncio de verti en spotify desgraciado de mierd"||||"876382662553980928"|https://twitter.com/alvaropema/status/876382662553980928
IvanFbcFb|2017-06-16 03:44|0|0|"El anuncio de Verti en Spotify xdddddd"||||"875529572816650240"|https://twitter.com/IvanFbcFb/status/875529572816650240
meet1Dourdream|2017-06-15 14:50|0|0|"me meo de la risa con el anuncio de verti en spotify el de "what a filiiis bis beliviisss""||||"875334783462723586"|https://twitter.com/meet1Dourdream/status/875334783462723586
SiluroGomes|2017-06-15 11:55|3|0|"Creo que el anuncio de Verti de Spotify es el peor que he tenido que sufrir con diferencia. En serio, qué asco dais @SpotifySpain"||@SpotifySpain||"875290616900571137"|https://twitter.com/SiluroGomes/status/875290616900571137
yeraygobeil|2017-06-13 01:04|0|0|"prefiero 27 anuncios de reggaeton antes del PUTO ANUNCIO DE VERTI DE SPOTIFY QUIERO ARRANCARME LOS TÍMPANOS DEL PUTO CRINGE"||||"874401997230919681"|https://twitter.com/yeraygobeil/status/874401997230919681
NachoMtnzWhite|2017-06-11 23:16|0|2|"no hay nada que me ponga mas de mala ostia que el anuncio de verti en spotify"||||"874012552241577984"|https://twitter.com/NachoMtnzWhite/status/874012552241577984
TheFranRubio|2017-06-10 11:46|0|0|"#verti en la puta vida os voy a contratar! Vuestro anuncio en Spotify es puto cáncer!"|||#verti|"873476425650720769"|https://twitter.com/TheFranRubio/status/873476425650720769
alareov|2017-06-06 02:51|0|1|"y lo buena que es la campaña de publicidad de verti de Spotify qué"||||"871892142364516353"|https://twitter.com/alareov/status/871892142364516353
algc19|2017-06-05 16:01|0|0|"Siempre pude aguantar cualquier anuncio de Spotify , pero el de Verti me obliga a quitarme los cascos. Ganas dan de desinstalar Spotify"||||"871728620858990592"|https://twitter.com/algc19/status/871728620858990592
DuarteEscariz|2017-06-05 09:52|0|1|"El anuncio de Verti de Spotify tiene delito"||||"871635737078374401"|https://twitter.com/DuarteEscariz/status/871635737078374401
urbanshee8|2017-06-04 00:18|0|1|"querido anuncio tarifa web de verti del spotify : soy muy fan"||||"871129088974495744"|https://twitter.com/urbanshee8/status/871129088974495744
kthxbyex|2017-05-22 21:17|0|0|"verti uma lágrima. eu talvez vá ao porto também no verão so eu aviso"||||"866734675737423872"|https://twitter.com/kthxbyex/status/866734675737423872
acdelrey|2017-04-21 23:18|0|1|"Reparei q to sem spotify premium e verti uma lagrima"||||"855531221979467778"|https://twitter.com/acdelrey/status/855531221979467778
hello_verti|2016-07-04 22:27|0|1|"Try listening to the comedy station on Spotify at work. Who says work can't be fun? Unless you work at a funeral home. Not. Appropriate."||||"750063546503827456"|https://twitter.com/hello_verti/status/750063546503827456
mindfirephoto|2015-03-28 12:50|0|1|"Los anuncios de Verti en Spotify te cortan todo el royo #MeIndigno"|||#MeIndigno|"581785504280104961"|https://twitter.com/mindfirephoto/status/581785504280104961
diego_machdream|2015-03-24 19:21|0|0|"Cada vez que escucho el anuncio de Verti y de la princesa en Spotify me entra un poco más de cáncer cada día"||||"580434304792178688"|https://twitter.com/diego_machdream/status/580434304792178688
pedrobuenohijo|2015-03-24 14:18|2|6|"SOY PREMIUM EN SPOTIFY . ADIÓS SEGURO PINTÓN DE VERTI . ADIÓS ZATU. ADIÓS TOSTADORA. ADIÓS A LA SIESTA. ADIÓS A LA FLAMENKITO PLAYLIST."||||"580357910653505537"|https://twitter.com/pedrobuenohijo/status/580357910653505537
SkylineWill__|2015-03-16 19:52|0|1|""Gracias por mirar este anuncio. ¡Disfruta de tus 30 minutos sin anuncios!" ... Y justo 2 seg., anuncio de Verti Seguros. Gracias @Spotify ."||@Spotify||"577543004908580864"|https://twitter.com/SkylineWill__/status/577543004908580864
a_naoii|2015-03-14 12:47|0|0|"Los anuncios que ponen en Spotify de Verti son muy random."||||"576711317521842176"|https://twitter.com/a_naoii/status/576711317521842176
LadyDaffne|2015-03-08 18:54|0|1|"Verti en Spotify no, PLS NO!"||||"574629324990603264"|https://twitter.com/LadyDaffne/status/574629324990603264
CristinaBFlor|2015-03-08 13:41|0|0|"No entiendo el anuncio de @verti en Spotify :S"||@verti||"574550559593787392"|https://twitter.com/CristinaBFlor/status/574550559593787392
4andreaff|2015-03-07 21:04|0|0|"Los anuncios de Verti en Spotify >>>>>>>>>"||||"574299503769051136"|https://twitter.com/4andreaff/status/574299503769051136
dramatictone|2015-03-06 11:09|0|0|"¿Ese exageradamente fingido acentazo andaluz del anuncio de Verti sólo nos lo tragamos los que nos conectamos a Spotify desde Andalucía?"||||"573787598667276288"|https://twitter.com/dramatictone/status/573787598667276288
xabiermendez9|2015-03-05 18:14|0|0|"No,venga ya,a ver Verti ,¿por que haces anuncios con acento andaluz y por que Spotify los pone?"||||"573532047051984897"|https://twitter.com/xabiermendez9/status/573532047051984897
rpa97|2015-03-03 16:53|1|0|"Me pregunto que pretenden los de seguros verti con el acento andaluz mal fingido en la publicidad de spotify ."||||"572786783676727296"|https://twitter.com/rpa97/status/572786783676727296
quesitosgiver|2015-03-03 08:47|0|0|"Escuchando las cuñas publicitarias de Verti en Spotify pienso cuántos clientes lograrán con ese sentido del humor tan excelso y trabajado."||||"572664578246619136"|https://twitter.com/quesitosgiver/status/572664578246619136
Brain_Daamage|2015-03-01 04:01|0|0|""La prinzeza ehta ehperando a ke zu compañia le recompense por seh fiehhl" Spotify anuncios - Verti"||||"571867796507897856"|https://twitter.com/Brain_Daamage/status/571867796507897856
mariabaach|2015-02-22 15:17|0|0|"El anuncio de Verti del spotify vamos a ver"||||"569501259516010496"|https://twitter.com/mariabaach/status/569501259516010496
Wickedwildpaw|2015-02-10 20:58|2|1|"Spotify de tus anuncios me da igual: -Los seguros Verti . -Que llegue San Valentin -Tus playlist Latino, la del gimnasio, y la del reggaeton."||||"565238287720534016"|https://twitter.com/Wickedwildpaw/status/565238287720534016
HeyJohnnyPark_|2015-01-18 22:01|0|0|"Que haces Verti en Spotify"||||"556919230298603521"|https://twitter.com/HeyJohnnyPark_/status/556919230298603521
lemmonadeire|2015-01-15 16:55|0|1|"Ya está, al tercer anuncio de Verti que ha salido he cerrado Spotify . Definitivamente me paso a Grooveshark"||||"555755212712206336"|https://twitter.com/lemmonadeire/status/555755212712206336
czechman45|2014-01-27 01:15|0|0|"jednoduše. jde to samozřejmě jen v desktopové verti Spotify , v sloupci vybereš Library což je tvá iTunes knihovna. pic.twitter.com/chroH5mm3B"||||"427595799040884737"|https://twitter.com/czechman45/status/427595799040884737
HugoPoidevin|2014-01-16 17:25|0|1|"Hallelujah ! A nous Thierry Pastor h24 ! cc @Kevin_Dufreche @PierreCucchi_NR @Aurelien_ Verti #Spotify #LastRT"||@Kevin_Dufreche @PierreCucchi_NR @Aurelien_|#Spotify #LastRT|"423853478797004800"|https://twitter.com/HugoPoidevin/status/423853478797004800
Masiliauskas|2013-10-18 23:02|0|0|"Kai Spotify iš tavo "starred" playlist'o radijo paleidžia tavo mylimiausią dainą, supranti, kad tie 25lt/mėn buvo to verti ."||||"391308285736808448"|https://twitter.com/Masiliauskas/status/391308285736808448
jaumepre|2013-04-01 20:28|0|0|"#NowPlaying Verti -Marte by The Twilight Singers on #Spotify http:// open.spotify.com/track/0GSE94H8 JECkRR9vb40GyZ …"|||#NowPlaying #Spotify|"318791967666479107"|https://twitter.com/jaumepre/status/318791967666479107
chrisboyddotnet|2012-07-07 17:55|0|0|"♫ Verti -Marte – The Twilight Singers http:// spoti.fi/L0fzxA #Spotify"|||#Spotify|"221633613769351168"|https://twitter.com/chrisboyddotnet/status/221633613769351168