kk	username	date	retweets	favorites	text	geo	mentions	hashtags	tid	LINK
0	vertiseguros	2017-08-10 12:30	1	2	Conviértete en el rey de los gadgets en casa con estas #apps pensadas para el confort. http:// ow.ly/JELT30edo10			#apps	8,95593158515601E+017	https://twitter.com/vertiseguros/status/895593158515601408
0	vertiseguros	2017-08-10 13:36	0	0	Hola @rafaparadela , si nos facilitas tu DNI o Nº de póliza por privado, localizaremos tu seguro y contactaremos contigo sobre este tema.		@rafaparadela		8,95609909043016E+017	https://twitter.com/vertiseguros/status/895609909043015684
0	vertiseguros	2017-08-11 12:30	1	4	Si quieres proteger a los que te rodean y a ti mismo, #UtilizaLaCabeza y abróchate el cinturón. pic.twitter.com/MXeT7NSlfo			#UtilizaLaCabeza	8,95955563858756E+017	https://twitter.com/vertiseguros/status/895955563858755585
0	vertiseguros	2017-08-14 12:30	0	0	Si eres inquilino #UtilizaLaCabeza , asegura tus pertenencias con el Seguro de Hogar de Verti y quédate tranquilo. http:// ow.ly/1mK830enRRc pic.twitter.com/04sqbRo5uz			#UtilizaLaCabeza	8,97042711248876E+017	https://twitter.com/vertiseguros/status/897042711248875520
0	vertiseguros	2017-08-16 11:57	0	0	Hola @ZHALIGdeZHALIG , pásanos por favor tus datos por privado para contactar contigo y ver cómo podemos solucionarlo. Un saludo y gracias .		@ZHALIGdeZHALIG		8,97759177665335E+017	https://twitter.com/vertiseguros/status/897759177665335296
0	vertiseguros	2017-08-16 11:57	0	0	Hola @ZHALIGdeZHALIG , pásanos por favor tus datos por privado para contactar contigo y ver cómo podemos solucionarlo. Un saludo y gracias.		@ZHALIGdeZHALIG		8,97759177665335E+017	https://twitter.com/vertiseguros/status/897759177665335296
0	vertiseguros	2017-08-16 12:30	1	1	Sabemos que ya ha pasado medio agosto y tienes la #NeuronaDeGuardia . ¡Disfruta lo que queda del #verano ! http:// ow.ly/1Da130enSpb pic.twitter.com/DcIiBF3Fsn			#NeuronaDeGuardia #verano	8,9776748731979E+017	https://twitter.com/vertiseguros/status/897767487319789568
0	vertiseguros	2017-08-17 04:54	0	0	Con una velocidad máxima así, ¿creéis que habría límite de velocidad? #UtilizaLaCabeza pic.twitter.com/nhYDJkD3ir			#UtilizaLaCabeza	8,98015144927674E+017	https://twitter.com/vertiseguros/status/898015144927674368
0	vertiseguros	2017-08-17 12:44	0	0	Hola Lorena, mándanos tus datos de póliza por privado y te contactamos nosotros. Un saludo y gracias .				8,98133514431984E+017	https://twitter.com/vertiseguros/status/898133514431983617
0	vertiseguros	2017-08-17 12:44	0	0	Hola Lorena, mándanos tus datos de póliza por privado y te contactamos nosotros. Un saludo y gracias.				8,98133514431984E+017	https://twitter.com/vertiseguros/status/898133514431983617
0	vertiseguros	2017-08-18 15:18	3	7	#TodosSomosCataluña #NoMásTerrorismo pic.twitter.com/iYTvkHPa8z			#TodosSomosCatalu #NoM	8,98534533192192E+017	https://twitter.com/vertiseguros/status/898534533192192000
0	vertiseguros	2017-08-21 08:08	0	0	Hola @jordisequeda, mándanos por favor tus datos por privado para poder contactarte y encontrar una solución a tu situación. Un saludo.		@jordisequeda		8,99513409451942E+017	https://twitter.com/vertiseguros/status/899513409451941889
0	vertiseguros	2017-08-21 12:45	0	0	#UtilizaLaCabeza y ahorra con la Tarifa Web de Verti al calcular tu seguro online: http:// bit.ly/2fXMEpR pic.twitter.com/7mLLUevG8C			#UtilizaLaCabeza	8,99583108223164E+017	https://twitter.com/vertiseguros/status/899583108223164417
0	vertiseguros	2017-08-22 13:25	0	0	¡CONCURSO! Si quieres ir al concierto #ViveDial con @Cadena_Dial entra en nuestro #Facebook y participa: https:// goo.gl/mJCPij pic.twitter.com/eamLcTNgJm		@Cadena_Dial	#ViveDial #Facebook	8,99955736595374E+017	https://twitter.com/vertiseguros/status/899955736595374080
0	yeraygobeil	2017-08-21 01:07	0	1	voy a denunciar a Verti ya por su puto anuncio asqueroso de Spotify ; es el primer anuncio que hace que cringee y me enfade simultáneamente				8,99407484829487E+017	https://twitter.com/yeraygobeil/status/899407484829487105
0	ZephyrBelinski	2017-08-06 15:25	0	0	Qué ha pasado?				8,94187575040201E+017	https://twitter.com/ZephyrBelinski/status/894187575040200704
0	ZephyrBelinski	2017-08-06 15:25	0	1	Sorry soy premium. Pero sí lo he escuchado en la radio jaja				8,94187771946041E+017	https://twitter.com/ZephyrBelinski/status/894187771946041344
